,title,rating,price,no_of_ratings,product_url,product_description,Manufacturer,asin
224,Baggit Women's Sling Bag - Medium (Beige),4.4 out of 5 stars,609,"2,026",https://www.amazon.in/Baggit-Womens-Sling-Bag-Beige/dp/B0B441G1G6,"Internal size - 40.5cm x 30.5cm x 1.7cm, external size- 42cm x 32cm x 3.5cm​​, compatible with most 15 - 15.6 inch laptop computers or notebook like Macbook Pro/Air/Surface book/HP/Acer/Asus/Samsung Chromebook etc.    Extra Storage Space - Two pockets in front, enough space to keeping mouse, cable, cellphone, memory cards, external hard drive, pens,coins etc.    Ultra-slim & Lightweight - Slim, portable and lightweight to take alone, or slide it into your briefcase, backpack or any other daybag, perfect for business, school or travel.    Shockproof - Multiple Layers Protection, PP foam padding layer and Polyester fabric lining for bump and shock absorption, protect your computer from accidental scratches.    Excellent Detail, Use Exquisite zipper and reinforced stitching on all stress points, ensuring the bag does not fall apart when carrying heavy goods. The first verticle designed laptop bag, you will feel the beauty of simple and good texture.",Tabelito and Delivered by Amazon.,B07CJCGM1M
225,"MOCA Waterproof Nylon Exterior with Soft Velvety Interior Sleeve Bag Pouch Carry Case for 13.3"" to 14 inch Laptops, MacBook (Black, 13.3 Inch)",4.2 out of 5 stars,1199,"3,621",https://www.amazon.in/MOCA-Waterproof-Exterior-Velvety-Interior/dp/B09FJT5SJJ,"Casual Waterproof Laptop Bag/Backpack for Men Women Boys Girls/Office School College Teens & Students with Rain Cover    PROUDLY MADE IN INDIA, Half Moon is proud to be an Indian Brand. We understand the importance of Indian manufacturing and supply chains. It is the time when we revive local industries that's why this bag is Made in India by Indians using Indian materials.    SPACIOUS AND LIGHTWEIGHT, Light weight and spacious laptop backpack with 3 compartments. One compartment is for carrying laptop inside, with padding for safety, and space for laptop accessories like charger, etc. Second large compartment for books, files and all your day to day essentials. And third compartment is for your extra stuff. It has provision for holding bottles on both sides and has padded shoulder straps for your comfort.    Target gender, unisex",Deewan  Enterprise and Delivered by Amazon.,B07CJCGM1M
226,Lavie Women's Beech Satchel Bag | Ladies Purse Handbag,4.2 out of 5 stars,1197,"1,820",https://www.amazon.in/Lavie-Beech-Womens-Satchel-Handbag/dp/B096KPM1KT,"Meets most domestic carry-on size requirements    Scratch and impact resistant material    Extra packing space to accommodate your last-minute shopping    Colour matched 3-digit Recessed TSA lock, Colour coordinated components bring a rich look to the bag    Recessed TSA lock for a premium look and to provide foolproof security during your travel    Recessed TSA lock for a premium look and to provide foolproof security during your travel",RetailEZ Pvt Ltd,B07CJCGM1M
227,Tabelito® Basic Laptop Bag Sleeve Case Cover Pouch for 15.6 Inch(39.6cm) Laptop Apple / Dell / Lenovo / Asus / Hp / Samsung / Mi / MacBook / Ultrabook / Thinkpad / Ideapad / Surfacepro (Blue),4.2 out of 5 stars,449,"8,510",https://www.amazon.in/Tabelito%C2%AE-Basic-Laptop-Sleeve-Surfacepro/dp/B09NDTCZ4N,"Package Contents, Embroidered Party Wear Clutch Women Handbag    Material, Polyester, Color, Grey    PRODUCT DIMENSION,27 x 17 x 1CM    Made of high quality silk material. This is the combination of traditional and modern embroidery work. This is completely handcrafted and the Embroidery work has been done on it    Perfect case for iPhone. The clutch bag fits most of the phones.",ETrade Online,B07CJCGM1M
228,"ASHAPURA SUITCASE BAGS Polyester Casual Laptop Backpack, Travel Computer Bag Water Resistant College Work School Bag (Blue)",3.7 out of 5 stars,349,255,https://www.amazon.in/ASHAPURA-SUITCASE-Polyester-Backpack-Resistant/dp/B09F5F445M,"Gift your shoulders and back the comfort of the AmazonBasics - Casual Backpack/Office Bag    It has 2 large compartments and 2 side pockets    Well-padded interior that keeps your laptop safe    Enough space for your other daily essentials like chargers, wallet, power bank, etc.    Compact and sleek design    Well-cushioned shoulder straps    Dimensions, LxWXH, 47 X 33 X 15 cm    Weight, 0.460 grams",Appario Retail Private Ltd,B07CJCGM1M
229,American Tourister Ivy Polypropylene 68 cms Black Hardsided Check-in Luggage (FO1 (0) 09 002),4.2 out of 5 stars,3899,384,https://www.amazon.in/American-Tourister-Polypropylene-FO1-002/dp/B08CS9NC8Y,"Adjustable Shoulder Handles / Two Bottle holders / Padded Handle / Reflector Logo    Dimensions , LxWxH- 31 x 18 x 47 cms    Laptop , 15.6 inches and below (Bigger than 15.6 not recommended)    No. of Compartments , 3 with full padding    NOT INCLUDED , NO RAIN COVER, Laptop, Headphones & Cable (Images only for display)",Appario Retail Private Ltd,B07CJCGM1M
230,"Kuber Industries Women's Handcrafted Embroidered Clutch Bag (Grey, CTKTC034517)",4.0 out of 5 stars,345,"5,547",https://www.amazon.in/Kuber-Industries-Handcrafted-Embroidered-Handbag/dp/B082VFZP9C,"Detailed with an attractive gold handle hardware along with small utility pouch to enchance the functionality of the bag    Stunning outside clasped with a detachable spacious mini pouch,that helps you keep your money,cards and keys for easy access while on the go,along with roomy compartments that enables you to keep your essentials organized    This bag will help you navigate between your worlds with effortless ease by coordinating it with your work wear or an outing with your girl pals    Made in India",Cocoblu Retail,B07CJCGM1M
231,AmazonBasics - Casual Backpack/Office Bag/ for a 15.6-inch Laptop,3.9 out of 5 stars,639,"2,816",https://www.amazon.in/AmazonBasics-Casual-Backpack-Office-15-6-inch/dp/B09W4VMZ79,"Material, Nylon, Inner Material, Polyester, Capacity, 50 Liters, Color, Grey & Navy Blue, Special Features, Back Padding, Chest Strap, Earphone Cord Support, Hip Belt, Integrated Rain Cover, Laptop Compartment, Telescope Handle, Water Bottle / Umbrella Pouch, Zip Closure, Padded Handles, Shoulder Strap,     Water Resistant; Warranty type, Manufacturer, 1 year domestic warranty; Internal compartments with organizer pockets and internal divider for organization     For Our Business & Fashionable Style Day Backpack; Age Range Description, Adult; Style Name, Travel Backpacks; Closure Type, Zipper Snap     Closure Type, Zipper Snap; Age Range Description, Adult; Style Name, Travel Backpacks     Strap Type, Double Handle; Pattern Name, Solid; Warranty Description, 1. Year Manufacturer Warranty; Compartment Description, Greater Than 17 Inches; Style Name, Country",A. H. Creation,B07CJCGM1M
232,ADISA Light Weight Laptop Backpack 32 Ltrs,3.7 out of 5 stars,499,139,https://www.amazon.in/ADISA-BP005-Weight-Casual-Backpack/dp/B07F3VDBV5,"Care Instructions, Hand Wash Only    This having two small front zippered pockets suitable for keys/napkins etc.    This backpack is made of polyester fabric and is treated to make it water-resistant.    One back pocket for passport/mobile.    This fanny pack has a huge main compartment suitable for a wallet, small notepad, pen, sunglasses& other belongings.    This fanny pack comes with a Premium YKK Japanese Zippers& sliders with an adjustable waist strap. Comes with The F Gear promise of quality and durability.",RetailEZ Pvt Ltd,B07CJCGM1M
233,Nelle Harper Women's Handbag,4.1 out of 5 stars,699,"3,684",https://www.amazon.in/Nelle-Harper-Womens-Shoulder-Dark/dp/B07RBR6NW2,"Material, Canvas    Dimensions, 7.50H X 21L X 19W Cms    Closure Type, Clasp    Strap Type, Adjustable; 2 Pockets    Inner Material Type, Nylon",CRAFTS MY DREAM and Delivered by Amazon.,B07CJCGM1M
234,HEROZ Hacker 50 litres Nylon Travel Laptop Backpack Water Resistant Slim Durable Computer Book Bag Tracking Fits Up to 17.3-inch Laptop (058- All) (Grey & Red),4.1 out of 5 stars,1519,"3,684",https://www.amazon.in/HEROZ-Backpack-Resistant-Computer-17-3-inch/dp/B083N53TWB,"Store your gear in this camera bag with its ergonomic, padded sling strap and adjustable and padded waist belt    Rotate the sling from back to front to access your camera quickly and easily    Organise both camera and accessories in this two-part bag with removable dividers    Use the three, built-in memory card pockets and secure your tripod with the external attachment    Store more accessories or personal items in the top compartment, stash pocket or front pocket    This bag fits one DSLR camera with attached zoom lens and up to two extra lenses or accessories    Fits most DSLR camera models    Dimensions, 39.4 cms x 20 cms x 15.9 cms (L x W x H)",Appario Retail Private Ltd,B07CJCGM1M
235,F Gear Miles Guc Grey Sports Waist Bag (3683),4.2 out of 5 stars,419,91,https://www.amazon.in/F-Gear-Miles-Guc-Grey-Waist-Bag/dp/B08NYHTPJ6,"Outer Material, PU / Synthetic Leather    Closure, Magnetic Button    No. of Compartments, 2    No. of Pockets, 1    Dimensions, LxWxH - 7.25 x 2.25 x 5.5 inches",ADISA International,B07CJCGM1M
236,CRAFTS MY DREAM Women's Cross Body (Multicolor) Rose casual sling Bag,4.0 out of 5 stars,299,"1,447",https://www.amazon.in/Crafts-My-Dream-Womens-CMD2904/dp/B0100BD0IW,Leather material black colored sling bag    14 centimeters height x 24 centimeters length x 7 centimeters width    Zip closure with handle    1 compartment    1 year domestic warranty against manufacturing defects    Do not expose to extreme heat,Cocoblu Retail,B07CJCGM1M
237,"Amazon Basics Camera Sling Bag, for DSLR Camera with Lens, Accessories, Adjustable Padded Strap, Black",4.3 out of 5 stars,1579,"2,859",https://www.amazon.in/AmazonBasics-SM1603111P-Camera-Sling-Bag/dp/B01FRDSAYW,"Size, 37 X 19 X 19 Cm    Two Pockets With Main Compartment & One Front Pocket    Adjustable Carry Handle    Fabric, Made Of Polyester",Soccer International Private Limited and Delivered by Amazon.,B07CJCGM1M
238,ADISA Women Girls Stripes Cross Body Sling Bag,4.4 out of 5 stars,575,79,https://www.amazon.in/ADISA-Women-Girls-Stripes-SL5100-BRO_Brown/dp/B0BD63DRLZ,"Closure, Snap    This bag is chic, textured and classy.Perfect for casual outings has 1 spacious compartment, 1 phone slot, 1 zipper slot and sling.    Synthetic Material Burgundy Handbag    Adjustable Strap snap closure with Adjustable Strap",Cocoblu Retail,B07CJCGM1M
239,Hidesign Women Sling Bag (Black),4.3 out of 5 stars,1999,225,https://www.amazon.in/Isle-Locada-Hidesign-Womens-Sling/dp/B07L6NX9WV,"Made in India product with light-weight and durable, allowing for high portability    Organizer, Mesh Zipper Pocket with Three Partition    Compatible with canon, Nikon, Sony, olympus, pentax and other DSLR's and photographic equipment    Included Items, Small Camera Bag, Detachable Shoulder Pad    Size, LxWxH, 8.5X10X5 inches, Capacity (Liters), 7",Appario Retail Private Ltd,B07CJCGM1M
240,Vector X Polyester Blitz Gym Bag (Grey-Orange),3.5 out of 5 stars,299,5,https://www.amazon.in/Vector-Polyester-Blitz-Gym-Grey-Orange/dp/B091MYFBBR,"Package Contents, 1 Piece Embroidery Lady Hand Bag    Material, Cotton    Product Dimension, 26cm x 8cm x 20cm    EASY EVERYDAY USE, Wear it to a summer work party or a regular office day, this perfect satchel is designed for all-day comfort. The cute cross body bag has a long chain strap. It can also hold all your personal belongings like mobile phones, wallets, credit cards, or even cardholders with absolute ease. Unlike those large handbags, you can well organise your items in this small and practical sling bag    Twin grab handles, This ladies bag comes with two grab handles to ensure your ease of carrying it. These handles are robustly built and you can rest easy that they will not tear or get damaged in the course of daily usage",ETrade Online,B07CJCGM1M
241,Van Heusen womens Sling - textured single color belt,4.5 out of 5 stars,1362,209,https://www.amazon.in/Van-Heusen-Woman-Spring-Summer-Burgundy/dp/B07MHFJ167,"Outer material, nylon, color, black    Water resistance, water resistant; dimensions, 34 x 24 x 76 cm (lxwxh)    Color, black",Stonehenge Retail,B07CJCGM1M
242,Arctic Fox Sling Shutter Topography Camera Bag,4.5 out of 5 stars,1199,283,https://www.amazon.in/Arctic-Fox-Shutter-Topography-Camera/dp/B0835GMWBC,"100% Polyester, High Quality, Durable and Water Resistant Fabric    Front storage pocket keeps smaller items neatly organized and easy to access    Mesh pockets on both sides to accommodate your water bottle and umbrella    Mesh Padding on back & shoulder strap to provide comfort & better back support; 1-year International Warranty against manufacturing defects    Special Features, Lightweight; Closure Type, Zipper; Age Range Description, Adult",RetailEZ Pvt Ltd,B07CJCGM1M
243,"Kuber Industries Embroidery Small Hand Bag, Tote Bag, Purse For Daily Trips, Travel, Office & All Occasions For Women & Girls (Gold)-HS_38_KUBMART21477",3.7 out of 5 stars,126,49,https://www.amazon.in/Kuber-Industries-Embroidery-Occasions-HS_38_KUBMART21477/dp/B095C9DPDM,"Outer Material, Nylon, Color, Black    Resistance, Water resistant    Dimensions, 34 cms x 23 cms x 43 cms (LxWxH)    Lightweight design    Compression and sternum straps",E.V.A.N,B07CJCGM1M
244,Wildcraft 60 Ltrs Black Rucksack (8903338073819),4.4 out of 5 stars,2645,593,https://www.amazon.in/Wildcraft-Ltrs-Black-Rucksack-8903338073819/dp/B01G5I8VBK,"Outer Material, Nylon, Color, Black    Resistance, Water resistant    Dimensions, 34 cms x 23 cms x 43 cms (LxWxH)    Lightweight design    Compression and sternum straps",E.V.A.N,B07CJCGM1M
245,Safari Sheild 26 Ltrs Water Resistant Casual Backpack - (SHEILD19CBBLK),4.0 out of 5 stars,699,"1,310",https://www.amazon.in/Safari-Sheild-Resistant-Casual-Backpack/dp/B09B26T7KQ,"SPACIOUS & LIGHTWEIGHT, Gizga Essentials Travel Toiletry Kit Bag can organize all your Travel Sized Toiletries like Toothbrushes, Toothpaste, Deodorants, Shampoos, Makeup & Cosmetics, Shaving Accessories. (Dim, 16 X 16 X 26CM | Weight, 194gm )    MULTI-POCKETS & HANGING HOOK, It has one Main Compartment, Three Mesh Pockets, and Two Outside Pockets allowing you to easily store all your Travel-Sized Toiletries. The attached Hook allows you to Hang the Bag on the Back of a Door or Towel Rail.    MANY APPLICATIONS, Our bag can be used as a Toiletry Bag, Travel Organizer Bag, Makeup & Cosmetic Bag, Healthcare Bag, or Gym Bag and is a perfect choice to take on any Business Trip, Outdoor Activity, or Vacation.    EASY TO CLEAN, Made of Sturdy, Durable, Water Resistance Fabric Material, No need to worry about getting Ripped and Worn easily. It has a Double Internal Lining which is Water Proof makes cleaning very easy. Premium Zippers & Pullers allow easy access to the inside.    PERFECT FOR TRAVEL, Durable handle allows to carry in hand conveniently. Easy to slide into your backpack or briefcase or carry it on its own, convenient for travel or business trip. Ideal toiletry Kit for Men & Women to hold your valuable Gadget Accessories.",Appario Retail Private Ltd,B07CJCGM1M
246,Wildcraft 45 Ltrs Black Rucksack (8903338073840),4.3 out of 5 stars,1738,"1,024",https://www.amazon.in/Wildcraft-Ltrs-Black-Rucksack-8903338073840/dp/B01G5I8VDS,"Ease off your shoulders with the AmazonBasics- Casual Backpack that helps carry laptops and other essentials comfortably    1 large compartment for keeping a laptop    The compartment can also be used for carrying personal belongings, other digital devices, books, notepads, etc.    Easily accessible front pocket for storing smaller items like phones, business cards, etc.    Made from water-resistant polyester fabric    Comfortable cushioned shoulder straps    Padded compartment at the back to support laptop    Dimensions and Weight, 45 cm (L) X 32 cm (B) X 13 cm (H); 0.460 grams",Appario Retail Private Ltd,B07CJCGM1M
247,"Gizga Essentials Travel Toiletry Kit Bag for Men & Women, Travel Organizer Case with Handle & Hook, Premium Zipper, Multiple Pockets, Multi-Utility Pouch for Shaving Makeup Cosmetics, Light Grey",4.1 out of 5 stars,1738,51,https://www.amazon.in/Wildcraft-Ltrs-Black-Rucksack-8903338073840/dp/B01G5I8VDS,"100% Polyester, High Quality, Durable and Water Resistant Fabric    Front storage pocket keeps smaller items neatly organized and easy to access    Mesh pockets on both sides to accommodate your water bottle and umbrella    Mesh Padding on back & shoulder strap to provide comfort & better back support; 1-year International Warranty against manufacturing defects    Special Features, Lightweight; Closure Type, Zipper; Age Range Description, Adult",RetailEZ Pvt Ltd,B07CJCGM1M
248,AmazonBasics 20 ltrs (33 Cms)Casual Backpack for 15.6-inch Laptop(CLB-1_black),4.2 out of 5 stars,399,384,https://www.amazon.in/Gizga-Essentials-Organizer-Multi-Utility-Cosmetics/dp/B09WVRKYCJ,"Ease off your shoulders with the AmazonBasics- Casual Backpack that helps carry laptops and other essentials comfortably    1 large compartment for keeping a laptop    The compartment can also be used for carrying personal belongings, other digital devices, books, notepads, etc.    Easily accessible front pocket for storing smaller items like phones, business cards, etc.    Made from water-resistant polyester fabric    Comfortable cushioned shoulder straps    Padded compartment at the back to support laptop    Dimensions and Weight, 45 cm (L) X 32 cm (B) X 13 cm (H); 0.460 grams",Appario Retail Private Ltd,B07CJCGM1M
249,Wildcraft 45 Ltrs Blue Rucksack (8903338073871),4.3 out of 5 stars,539,"2,099",https://www.amazon.in/Amazon-Basics-Casual-Backpack-15-6-inch/dp/B09W4WJ1CB,"SPACIOUS & LIGHTWEIGHT, Gizga Essentials Travel Toiletry Kit Bag can organize all your Travel Sized Toiletries like Toothbrushes, Toothpaste, Deodorants, Shampoos, Makeup & Cosmetics, Shaving Accessories. (Dim, 16 X 16 X 26CM | Weight, 194gm )    MULTI-POCKETS & HANGING HOOK, It has one Main Compartment, Three Mesh Pockets, and Two Outside Pockets allowing you to easily store all your Travel-Sized Toiletries. The attached Hook allows you to Hang the Bag on the Back of a Door or Towel Rail.    MANY APPLICATIONS, Our bag can be used as a Toiletry Bag, Travel Organizer Bag, Makeup & Cosmetic Bag, Healthcare Bag, or Gym Bag and is a perfect choice to take on any Business Trip, Outdoor Activity, or Vacation.    EASY TO CLEAN, Made of Sturdy, Durable, Water Resistance Fabric Material, No need to worry about getting Ripped and Worn easily. It has a Double Internal Lining which is Water Proof makes cleaning very easy. Premium Zippers & Pullers allow easy access to the inside.    PERFECT FOR TRAVEL, Durable handle allows to carry in hand conveniently. Easy to slide into your backpack or briefcase or carry it on its own, convenient for travel or business trip. Ideal toiletry Kit for Men & Women to hold your valuable Gadget Accessories.",Appario Retail Private Ltd,B07CJCGM1M
250,Safari Sheild 26 Ltrs Water Resistant Casual Backpack - (SHEILD19CBBLK),4.0 out of 5 stars,699,"1,310",https://www.amazon.in/Safari-Sheild-Resistant-Casual-Backpack/dp/B09B26T7KQ,"Outer material, nylon, color, blue    Water resistance, water resistant; dimensions, 34 cms x 23 cms x 45 cms (lxwxh)    Color, blue",Stonehenge Retail,B07CJCGM1M
251,AmazonBasics 20 ltrs (33 Cms)Casual Backpack for 15.6-inch Laptop(CLB-1_black),4.2 out of 5 stars,539,384,https://www.amazon.in/Amazon-Basics-Casual-Backpack-15-6-inch/dp/B09W4WJ1CB,"Water Proof Fabric - Our Yoga Mat Cover is designed with Polyester waterproof fabric, which would helpful for mat protection from water, rain and also increases the mat and yoga bag life.    Yoga Mat Bag is full length with top closure and with stylish log on the front with carrying strap which gives gives a stylish and elegant look to the bag.    Adjustable Strap - Yoga Bag comes with the adjustable long and broad shoulder strap which is helpful while travelling and carrying mat to yoga centres or parks.    Comfortable Size - The yoga mats of sizes from 4mm to 10mm would easily fit to the yoga bag and yoga bag is 28.5 inches long and 8 inches wide .    Care Instructions - Do not bleach only Hand or machine wash in cold water & air dry.",arpan enterprise and Delivered by Amazon.,B07CJCGM1M
252,"Gizga Essentials Travel Toiletry Kit Bag for Men & Women, Travel Organizer Case with Handle & Hook, Premium Zipper, Multiple Pockets, Multi-Utility Pouch for Shaving Makeup Cosmetics, Light Grey",4.1 out of 5 stars,399,51,https://www.amazon.in/Gizga-Essentials-Organizer-Multi-Utility-Cosmetics/dp/B09WVRKYCJ,"Package Contents, 1 Piece Embroidery Lady Hand Bag    Material, Cotton    Product Dimension, 26cm x 8cm x 20cm    EASY EVERYDAY USE, Wear it to a summer work party or a regular office day, this perfect satchel is designed for all-day comfort. The cute cross body bag has a long chain strap. It can also hold all your personal belongings like mobile phones, wallets, credit cards, or even cardholders with absolute ease. Unlike those large handbags, you can well organise your items in this small and practical sling bag    Twin grab handles, This ladies bag comes with two grab handles to ensure your ease of carrying it. These handles are robustly built and you can rest easy that they will not tear or get damaged in the course of daily usage",ETrade Online,B07CJCGM1M
253,Wildcraft 45 Ltrs Blue Rucksack (8903338073871),4.3 out of 5 stars,1599,"2,099",https://www.amazon.in/Wildcraft-Ltrs-Blue-Rucksack-8903338073871/dp/B01G5I8YAI,"Care Instructions, Hand Wash Only    This having two small front zippered pockets suitable for keys/napkins etc.    This backpack is made of polyester fabric and is treated to make it water-resistant.    One back pocket for passport/mobile.    This fanny pack has a huge main compartment suitable for a wallet, small notepad, pen, sunglasses& other belongings.    This fanny pack comes with a Premium YKK Japanese Zippers& sliders with an adjustable waist strap. Comes with The F Gear promise of quality and durability.",RetailEZ Pvt Ltd,B07CJCGM1M
254,Prarabdh Yoga Mat Bag from Women & Men and Shoulder Strap Water Proof Yoga Mat Cover (Blue Color),3.6 out of 5 stars,195,32,https://www.amazon.in/Prarabdh-Pocket-Shoulder-Strap-Water/dp/B09FZ2N1VQ,"Dedicated laptop compartment with multi-fit cradle fits up to 15.6”    Advanced air mesh back panel for support and comfort    Adjustable and ergonomic padded shoulder straps    Easy access front zippered pocket    Side mesh pockets for water bottle and small accessories    Integrated pass-through trolley strap system for convenient travel    Lightweight, weather-resistant materials    2yrs warranty",Appario Retail Private Ltd,B07CJCGM1M
255,"Kuber Industries Embroidery Small Hand Bag, Tote Bag, Purse For Daily Trips, Travel, Office & All Occasions For Women & Girls (Gold)-HS_38_KUBMART21477",3.7 out of 5 stars,126,49,https://www.amazon.in/Kuber-Industries-Embroidery-Occasions-HS_38_KUBMART21477/dp/B095C9DPDM,Combination of functional & safety features in stylish design. 3 Spacious Main Compartment 1 Front Zip Pocket Printed Design 10 mm Padded Buildt to last Strap Fabric Bottle Holder on the side.,RetailEZ Pvt Ltd,B07CJCGM1M
256,F Gear Miles Guc Grey Sports Waist Bag (3683),4.2 out of 5 stars,419,91,https://www.amazon.in/F-Gear-Miles-Guc-Grey-Waist-Bag/dp/B08NYHTPJ6,"Outer Material, Nylon, Color, Orange. With Rain Cover , No    Water resistance dimensions, 56.8cms x 33.6 cms x 5.4 cms (LxWxH)    Top loading pack with draw string opening for easy and quick access    Strengthened haul loop to take on heavier loads; Volume Capacity - 45 Liters    Style Name, Rucksack Backpacks; Special Features, Back Padding; Closure Type, Drawstring; Age Range Description, Adult; Pocket Description, Utility Pocket",CLOUD STATION,B07CJCGM1M
257,"Targus 12.5-15.6"" Geolite Advanced TSB96201GL Backpack (Slate Grey)",4.5 out of 5 stars,2448,143,https://www.amazon.in/Targus-12-5-15-6-Advanced-TSB96201GL-Backpack/dp/B07JQJTRHY,"Made From 100% Sustainable And Natural Materials.; Zipper Closure. One Small Compartment Inside .    This Eco-Friendly Bag Is Entirely Designed And Made In India Using Finest Quality Materials.    Well Stitched Sturdy Handle To Ensure Comfortable Grip.    This Latest Trendy Bag Is Perfect For Effortless Style For Beach, Vacay, Shopping, Coffee Meet Ups, College Works, Travelling, Etc.    Outer Material Type, Cotton",ASTRID BAGS and Delivered by Amazon.,B07CJCGM1M
258,Skybags Riddle 2 Blue 45 Cms Casual Backpack,4.4 out of 5 stars,1143,58,https://www.amazon.in/Skybags-Riddle-Blue-Casual-Backpack/dp/B08Z298H44,"Closure, Zipper    Innovative design, Utility of a messenger bag with convenience of a laptop sleeve    Built with premium nylon material with impact resistant foam cushion and imported soft fur lining with 3D foam cushion around which prevents scratches, premium and exquisite zipper closure, Multipurpose pocket    Convenient, comfortable and elegant, Two front zipper pocket to organize accessories has ample storage for your power bank, phone, charger, tabs, cable, pen, notebook, etc    Comes with adjustable and removable shoulder strap for easy portability and retractable handle at top    A much safer way to carry laptop, The bag is made of soft and materials with reinforced edges and good padding of the main compartment offer well protection for your laptop    Compatible with, Compatible with all the major brands of laptop including Acer, Apple iPad, Tabs, ASUS, HP, DELL, Microsoft Surface, Lenovo, Toshiba, Sony, Fujitsu, Sony Vaio etc",Appario Retail Private Ltd,B07CJCGM1M
