,title,rating,price,no_of_ratings,product_url,product_description,Manufacturer,asin
57,"Large Capacity Cosmetic Travel Bag, Women's Makeup Travel Bag Portable Leather Cosmetics Bag, Makeup Storage Bags with Handle and Divider, Wide Opening Cosmetic/Makeup Organizer Bags(Pink)",4.3 out of 5 stars,799,107,https://www.amazon.in/Capacity-Cosmetic-Portable-Cosmetics-Organizer/dp/B0BK922Y5N,"High-Quality Materials , Travel makeup pouch made of easy-to-clean PU leather fabric, special water-resistant surface to prevent internal products from getting wet.    PU Leather makeup bag function , Portable and Lightweight design with handle, Made of high-quality soft PU leather fabric, strong thickness make the bag more durable and easy to clean, special water-resistant surface to prevent internal products from getting wet.No need to worry about messy leaks when traveling.    Multifunctional storage makeup bags , This Make up Bags not only can storage your cosmetics, but also Jewelry, Electronic Accessories, Camera, Essential oil, Toiletries, Shaving Kit, glasses,Valuable objects and so on.    Convenient and Durable Handle , The zipper of the makeup travel bag opening design is reasonable,It's a easy to handle and very practical zipper pouch    Wonderful Gift , The travel makeup bag is perfect for daily use or travelling, it's a great gift for women and girls with the gift box on Mother's Day, Women's Day or Christmas .",SAMAJ VENTURE,B07CJCGM1M
58,"SHALIMAR large capacity Travel bag / Storage bag / Move-in bags/ Duffel Bag - Strong, Durable , Foldable and Water Resistant ( Pack of 1 ) ( Blue )",4.1 out of 5 stars,247,270,https://www.amazon.in/Shalimar-Capacity-Travel-Storage-Duffel/dp/B09TPHFMX7,"Easy Backpack to carry    Convenient Handles    Easy to fold and Store    Sturdy and Durable    Closure Type, Zipper; Strap Type, Adjustable; Handle Type, Web Handle",Shalimar Thermoforming Industries,B07CJCGM1M
59,"HOT DELIVERY BAGS Insulated and Waterproof Door Hanging Bag for Milk Sachets and Bottles Storage, Durable and Light Weight (Sea Green)",4.5 out of 5 stars,649,250,https://www.amazon.in/HOT-DELIVERY-BAG-Insulated-waterproof/dp/B08VJ4VWGZ,"Durable and Lightweight - The Door Hanging Bag is strong and lightweight, holds your bottles snugly in place and protects bottles from breaking. Stain-resistant, reusable and time again, perfect bottle carrier.    Waterproof PVC Fabric for Outer Material & Thermally PET Insulated Linings i.e. Aluminum Linings for Inner Fabric    6 Way Insulation to keep the Milk Cold and Fresh in Any climate, 1 Liter Bottle, 500 ml Bottles ,250 ml Milk bottles can easily be accommodated inside the Insulated Milk Door Hanging Bags    Door Hanging bags are Made From Soft Fabric that protects Milk Glass Bottles from Dust & Scratches and keep the Bottles Temperature stable what it is loaded at    Ice Packs are used to soak the moisture from the bottle and maintain a stable temperature inside the bag",HOT DELIVERY BAG,B07CJCGM1M
60,Gear Triumph 26L Water Resistant School Bag//Backpack/College Bag for Men/Women - Navy Blue,4.2 out of 5 stars,769,"5,375",https://www.amazon.in/Gear-Beige-Casual-Backpack-BKPTRMP520522/dp/B00VWM11HQ,"Outer Material, Polyester, Inner Material, Polyester, Color, Navy Blue and Beige; Anti-sweat fabric on inner-side of shoulder straps    Wear Resistant, Wearproof, Water Resistance, waterproofDimensions, 32 cms x 18 cms x 47 cms (LxWxH)    Capacity, 26 liters, Weight, 0.534 Kg    Number of compartments, 3; Strap Type, Adjustable    Age Range Description, Adult; Pocket Description, Utility Pocket; Style Name, Traditional Backpacks; Closure Type, Zipper; Special Features, Back Padding",RetailEZ Pvt Ltd,B07CJCGM1M
61,Gear Classic 20L Faux Leather Water Resistant Anti Theft Laptop Bag/Backpack for Men/Women-Tan,4.4 out of 5 stars,999,"2,268",https://www.amazon.in/Classic-Leather-Laptop-Backpack-LBPCLSLTH1901/dp/B07G4CYC74,"Outer material, synthetic, color, tan; Waterproof    Capacity, 20 liters; Weight, 560 grams; Dimensions, 48 cms x 32 cms x 14 cms (LxWxH)    Number of compartments, 2    Laptop compatibility, yes, laptop size, 16strap type, adjustable    Age Range Description, Adult; Special Features, Back Padding; Pocket Description, Utility Pocket; Closure Type, Zipper    Concealed quick access Pockets on back panel ,Adjustable Anti sweat padded Shoulder straps , Padded Laptop sleeve,2 External Pockets, Padded Back Panel Cushioned with Anti Sweat Fabric,Embedded Organizer , USB and Headphone cable slot .",RetailEZ Pvt Ltd,B07CJCGM1M
62,"Motherly Diaper Bags for Mom Travel Basic Edition (Navy Blue,Pack of 1)",4.5 out of 5 stars,1516,"2,470",https://www.amazon.in/Motherly-Diaper-Bags-Travel-Basic/dp/B07PKQ3WJZ,"Capacity, 19 liters, Weight, 566gm     What’s new, Well-researched, upgraded fabric and hardware (zippers, rivets, gauge buttons) which is exclusively used to save you those extra bucks while maintaining the highest quality standards!! Light-weighted. Won’t add bulk and yet durable to sustain heavy weight.KEEP HOT WATER OR MILK WARM - Warm time of hot water or milk stored in the milk bottle pockets is 2 hours.     Pattern Name, Solid; Lining Description, Polyurethane; Age Range Description, Adult",Clickr eStore Pvt. Ltd.,B07CJCGM1M
63,"Chic Buddy Waterproof Wet Bag, Washable, Reusable for Travel, Beach, Pool, Stroller, Diapers, Dirty Gym Clothes, Wet Swimsuits, Toiletries",4.5 out of 5 stars,299,256,https://www.amazon.in/Chic-Buddy-Waterproof-Swimsuits-Toiletries/dp/B09KSBHC18,"One compartment ( Number of Pocket.3)    Size, Large / Looked, Beautiful Messenger/Tote bag    Outer Material Type, Polyurethane",ALIZA LIFESTYLE and Delivered by Amazon.,B07CJCGM1M
64,ALIZA Women's Tote Bag,4.0 out of 5 stars,426,"7,624",https://www.amazon.in/ALIZA-Womens-Tote-Bag-Black/dp/B08JJ8RQNR,"Outer material, synthetic, color, Tan    Waterproof, Capacity, 27 liters; Weight, 600 grams; Dimensions, 48 cms x 33 cms x 18 cms (LxWxH)    Number of compartments, 2; Laptop compatibility, yes, laptop size, 16strap type, adjustable    Warranty type, Manufacturer; one year warranty against all manufacturing defects, workmanship, assistance during time of claim of warranty    Closure Type, Zipper; Special Features, Back Padding; Age Range Description, Adult; Pocket Description, Utility Pocket    Concealed quick access Pockets on back panel ,Adjustable Anti sweat padded Shoulder straps , Padded Laptop sleeve,3 External Pockets, Padded Back Panel Cushioned with Anti Sweat Fabric,Embedded Organizer , USB and Headphone cable slot .    Concealed quick access Pockets on back panel ,Adjustable Anti sweat padded Shoulder straps , Padded Laptop sleeve,3 External Pockets, Padded Back Panel Cushioned with Anti Sweat Fabric,Embedded Organizer , USB and Headphone cable slot .",RetailEZ Pvt Ltd,B07CJCGM1M
65,Gear Vintage2 Anti Theft Faux Leather 18 cms Tan Laptop Backpack,4.4 out of 5 stars,989,"1,404",https://www.amazon.in/Gear-Vintage2-Leather-Backpack-LBPVG2LTH1901/dp/B07G4F3758,"Warranty ,- 1 Year Warranty On Manufacturing Defects. 100% Quality Assured.    Dimensions (In Inches) ,- 9"" Tall X 14"" Wide X 4"" Deep    Compartments ,- 3 Zip Compartments And 1 Back Zip Pocket    Material ,-100% PU | Colour ,- Maroon",FOSTELO,B07CJCGM1M
66,Fostelo Handbag For Women And Girls | Ladies Purse Faux Leather Satchel Bag | Woman Gifts | Wedding Gifts For Women | Women 3 Compartments Bag | Travel Purse Hobo Bag | 5 Pockets Shoulder Bag,4.1 out of 5 stars,498,"8,913",https://www.amazon.in/Fostelo-CATLIN-Womens-Handbag-Maroon/dp/B079MD5F7R,"Made with Love in India.    Constructed Using Water Repellant High Quality Polyester & top-notch Hardware.    Extremely Slim, Intelligent Design - Easy to Handle, yet Ample Space for Daily Essentials    Well Padded Laptop Compartment, Designed for Laptops with Screen Size Between 14 to 15.6 Inches.    Carry Using the Grab Handles or On-Shoulder using the Included, Comfortable Shoulder Strap.",Protecta,B07CJCGM1M
67,Protecta The Professional Laptop Bag Briefcase for Laptops with Screen Size Up to 15.6 Inch (Black & Indian Geometric Print),4.4 out of 5 stars,699,"1,382",https://www.amazon.in/Protecta-Professional-15-6-inch-Briefcase-Geometric/dp/B07GNCRCP4,"Padded, Comfortable Shoulder Strap    Easy access front pocket    Soft Grip handles    Stylish Design",RetailEZ Pvt Ltd,B07CJCGM1M
68,VIP Polypropylene 48 Cms Travel Bag(DFENDEBRN_Brown),4.3 out of 5 stars,899,334,https://www.amazon.in/VIP-Endura-Puller-Brown-Duffle/dp/B0B527KJQZ,"Material, High quality Waterproof Polyester material and nice eye catchy handbag    3 Big compartments with Zip closure and 6 Pockets that can easily carry your multiple utility for better organization.    Dimensions, Length, 35, Width, 18, Height, 27 cm, Closure, Zip; Strap Type, Shoulder    High quality soft Lining Anti-theft pocket with Top Zip Closer; Extra pockets for more space and easy to carry, the extra pocket on the inside comes with a closure so you can put all your important things inside like mobile, keys, jewellery, napkins, etc. Safely without the fear of losing them",WildModa International and Delivered by Amazon.,B07CJCGM1M
69,"WILD MODA Women's Shoulder Bag, Set of 1",4.3 out of 5 stars,849,"3,316",https://www.amazon.in/WILD-MODA-Womens-Shoulder-Turquoise/dp/B099PLT91X,"Made of durable water-resistant exterior fabric as well as protective soft padded interior. Laced with zippers for a long life span. it's also called such as side bag for men and sling bags for men .bag for men    Laptop bags Ultra Protection, Tabelito laptop shoulder bag features protective padding at the bottom of the individual laptop compartment and ultra-thick. you can use it as bags for mens ,side bag for men / side bag for men / office bag for women / gift for men . it's can be use as a interview bag or interview purpose    Well-organized, The main compartment features a laptop slot and a tablet slot for up to 11"" iPad Pro with smart case & keyboard. its also use as a office bag for women , office bag for men    Compact and Easy to Carry, Being lightweight, this bag can be comfortably carried with the handle . you can use it such as shoulder bag men , messenger bags for men , leather laptop bags for men/ laether briefcase / leather bag for men / office bag for women / laptop accessories / backpack for women    Adjustable shoulder strap, or hang on your suitcase through the luggage strap or slipped inside your backpack, messenger bag    Bag is perfect to carry laptops notebook up to 15.6 inch include 2019 New MacBook Pro 16 , MacBook Pro (Retina) 15, and other 14-15.6 inch Dell XPS / HP    Two front pockets With small and large pockets, and multiple elastic bands to make it easier than ever to organize accessories such as charger, cable, mouse, hub etc.",Appario Retail Private Ltd,B07CJCGM1M
70,Tabelito® Laptop Bag For Men and women Briefcase 15.6 Inch (39.6 cm) Messenger Side Shoulder Travel bags for mens Water Resistant gifts office bag for men,4.0 out of 5 stars,549,"2,370",https://www.amazon.in/Tabelito-Office-Laptop-Briefcase-Women/dp/B08FKXCJNQ,Sling bag with contrast handle    16.5 cm height x 18.5 cm length x 7 cm width    Single compartment with flap    Stylish and compact sling bag that is perfect for casual outfits,Cocoblu Retail,B07CJCGM1M
71,Amazon Brand - Eden & Ivy Women's Sling Bag,4.1 out of 5 stars,999,559,https://www.amazon.in/Amazon-Brand-Womens-Sling-Mustard/dp/B07XBZR7SR,"PERFECT SIZE & STORAGE SPACE, Laptop backpack with perfect size to hold things and your 15.6 inch laptop or 15 inch, 14 inch Laptop. Convenient main pockets for iPad, charger, binders, books, clothes, ect. Inside pockets keep your wallet, phone. bags for women / kids school bag / college bags for boys / laptop backpack    Front two slanted pocket perfect for quick finds such as your ID for work. keys for open door, two side pockets for water bottle and compact umbrella make your items organized. it can be use as school college bags for girls / backpack for men /backpacks for women . you can use it as a gift for men . bags for travelling    COMFY & STURDY, Made from WATER RESISTANT and DURABLE ECO-FRIENDLY nylon fabric with Two PADDED shoulder straps, relieve the stress of shoulder, simple but comfortable back design offer your great back support, making your working, journey and travelling more convenient wherever you go. you can use it such as office bag for men. office bag for women .    Light-weight Carrying and perfect for business traveling or trip, weekend getaways, back to school, outdoor activities and college bag for men etc;    MULTIPURPOSE & SIZE, 20 x 12.2 x 5.7 Inch, perfect to throw under your seat on an airplane when you are traveling or on business trip. Suitable for back to school college, can be easily stored. Good choose for a business laptop backpack, work backpack, laptop bag for men and women, also will be a good gifts for women, gifts for men, gifts for boyfriend or girlfriend and gift bag for travelers.",Appario Retail Private Ltd,B07CJCGM1M
72,"Tabelito® Casual Laptop Bag 15.6-inch(39.6cm), 25 LTR Water Repellent Backpack Office College School Business Travel Bags for Men Women Boys & Girls (Blue)",4.2 out of 5 stars,599,"1,499",https://www.amazon.in/Tabelito-Laptop-Backpack-15-6-inch-Repellent/dp/B08Y3KCN32,Both Professional and Stylish    Large zippered main compartment with laptop sleeve up to 17”.    Adjustable straps fit perfectly over the shoulders    Size-(LxHxW) Cm-(31x46x21) Cm    It Comes With the F Gear Promise of Quality,RetailEZ Pvt Ltd,B07CJCGM1M
73,F Gear Tycoon 27 Liters Laptop Backpack Sch Bag(Black),4.4 out of 5 stars,549,202,https://www.amazon.in/F-Gear-Tycoon-Laptop-Backpack/dp/B071XJ6XV5,"String backpack have one main compartment is secured with drawstring closure.    Efficient to hold your essentials.    Highly water-resistant finish to save inner items from water splashes.    Strong and durable ropes.    Designed for all types of occasions, Sports, daily use, cycling etc.",RetailEZ Pvt Ltd,B07CJCGM1M
74,Nivia Polyester String Bag,4.1 out of 5 stars,1168,968,https://www.amazon.in/Nivia-5177BK-Polyester-String-Black/dp/B071XM6PSM,"Made of multi-coated 600D polyester Material ; Water Repellent    Dimension, 38cm x 26cm x 14cm (LxWxH); Weight , 200 grams; Capacity, 12liters    Small Size backpack; Laptop Compatibility, No    This backpack comes with 2 zipper pockets that can house a notebook, gym gear, travel essentials and more    With contra zippers and adjustable straps this light weight backpack is the ideal companion while at the airport or hitting the gym or exploring new city or using it as a carrier for books    6 months limited warranty",Appario Retail Private Ltd,B07CJCGM1M
75,"Mi Step Out 12 L Mini Backpack (Small Size, Red, Water Repellant)",4.1 out of 5 stars,139,"7,630",https://www.amazon.in/Step-Backpack-Small-Water-Repellant/dp/B088XG77KN,"Warranty ,- 1 Year Warranty On Manufacturing Defects. 100% Quality Assured.    Dimensions (In Inches) ,- 12"" Tall X 17"" Wide X 6"" Deep    Compartments ,- 1 Zip With 2 Compartments And 1 Back Zip Pocket    Material ,-100% PU | Colour ,- Tan",FOSTELO,B07CJCGM1M
76,Fostelo Handbag For Women And Girls | Ladies Purse Faux Leather Satchel Bag | Woman Gifts | Wedding Gifts For Women | Women 2 Compartments Bag | Travel Purse Hobo Bag | 4 Pockets Shoulder Bag,3.9 out of 5 stars,254,"6,991",https://www.amazon.in/Fostelo-Style-Diva-Womens-Handbag/dp/B00Z0NMFKU,"Ergonomically Designed , Spacious with Multiple Compartments & Pockets , Intuitive Access , Cushioned Back Panel & Shoulder Straps , Lightweight    Premium Anti-Scratch Faux Leather , Bartacked Load Points , Water Resistant Fabric , Heavy Duty Long Lasting Zippers    Padded Velcro'ed Sleeve fits upto 15.6"" Laptop , Padded Base    Secret Anti-Theft Pocket with Slot for Charging Wire",RetailEZ Pvt Ltd,B07CJCGM1M
77,Gear Parker 23L Water Resistant Anti Theft Laptop Bag/Backpack for Men/Women - Black,4.3 out of 5 stars,498,302,https://www.amazon.in/Gear-Executive-Anti-Theft-Backpack-BKPPKREXE0101/dp/B097KCMQKG,"PROFESSIONAL PHOTOGRAPHER’S DSLR & ACCESSORY CARRY BAG, Carry DSLR/SLR camera, lens, tripod, flash light & other accessories, This hiking camera backpack is 10”x6""x13” and yet lightweight, allows you to carry all kinds of equipment    100% MADE IN INDIA PRODUCT WITH DURABLE, WATER RESISTANT MATERIALS, This Product is Made-in India with high-quality water resistant nylon and polyester, durable metal zippers, this bag lets you carry your expensive equipment safely in all weathers    EXTERNAL BASE ZIPPER ENCLOSURE WITH WATERPROOF COVER, MESH POCKET & STRAP TO CARRY TRIPOD, The waterproof cover is located conveniently at the base zipper enclosure, at the event of rain, you don't have to open the bag, just unzip the base enclosure and pull out the cover. Adjustable Strap on one side can easily carry a tripod and mesh pocket is ideal to carry a water bottle.    ADJUSTABLE CUSTOMISABLE PADDED DIVIDERS WITH VARIOUS MESH POCKETS, You can make space according to your gear. Remove all the padded dividers if you want to use it as a regular backpack, just remove the dividers and carry your stuff. You can also carry cables, chargers, lens cleaners etc in the zipper mesh pockets.    TWICE CUSHINED SUPER QUALITY HANDLE, The best in class twice cushioned top handle provided maximum comfort while holding the bag from the handle.",Appario Retail Private Ltd,B07CJCGM1M
78,"Osaka Pro Series-11 Waterproof DSLR Backpack Camera Bag, Lens Accessories Carry Case for Nikon, Canon, Olympus, Pentax & Others-Made in India",3.9 out of 5 stars,649,553,https://www.amazon.in/Osaka-Pro-Waterproof-Accessories-Others-Made/dp/B081Z1TVPQ,"Boxy shape for maximum volume and retractable top and side handles for comfort    Dual texture with matte finish and 3 digit fixed combination lock for extra security    Cross ribbons in bottom compartment and U-shaped pocket for maximum packing space    Sturdy and lightweight, with 360-degree smooth rolling wheels    50-50 packing makes organization and segregation easier",RetailEZ Pvt Ltd,B07CJCGM1M
79,American Tourister Polypropylene Hard 68 cms Luggage- Suitcase(LG4 (0) 08 002_Iron Grey),4.0 out of 5 stars,880,152,https://www.amazon.in/American-Tourister-Polypropylene-LG4-08/dp/B0BB2LX7LW,"Made in premium quality faux leather - 23cm length x 10 cm width x 19 cm height    1 main compartment with a flap over top zip closure, 1 internal slip pocket and 1 zippered back pocket    Light-weight shoulder bags, with gold hardware and an edgy look, it is a comfortable carry    Stylish sling bag for women for all occasions; adjustable cross-body sling strap for convenience and comfortable carry    There might be minor color variation between actual product and image shown on screen due to lighting on the photography",Cocoblu Retail,B07CJCGM1M
80,Lavie Women's Medium Mamo Dome Sling Bag | Ladies Purse Handbag | Crossbody Sling Strap,4.0 out of 5 stars,658,"1,372",https://www.amazon.in/Lavie-Spring-Summer-Womens-Sling/dp/B081KGQ3M4,"Protect your precious 15.6-inch laptop with the padded panels. Dual pocket protection design provides dual compartments for laptops and tablets.    Padded shoulder straps enable comfort even when the bag is at max load, plus a mesh padded back panel to support and keep you cool and comfortable even on extended use.    Special features like Back Trolly sleeve and Padded Grab handle are added advantages of the backpack.    Recharge your notebook and devices while you work or while they're connected to the bank inside your bag; or use the bank as a backup battery.    Rest easy with one-year limited warranty from the manufacturer.",Appario Retail Private Ltd,B07CJCGM1M
81,HP Lightweight 300 Grey Laptops Backpack with Crafted Cable Pass Through and Padded Shoulder Straps,4.1 out of 5 stars,1002,67,https://www.amazon.in/HP-Lightweight-300-Grey-Backpack/dp/B08CY44PVD,"Lavie Malnov tote is a stylish offering for ladies. It is durable, light weight and super spacious. Made from vegan leather, this large hand bag comes in Herringbone, Woven and Croco texture pattern at the front.    Woven Texture- 45 cm in length x 12 cm in width x 35 cm in height    Malnov hand bag has a top zip closure for safety and comfort. The interior has 2 slip pockets along with 1 zip pocket providing plenty of storage space for keeping phone, portable charger, keys, hairbrush, wallet, sunglasses, sanitizer and a pair of clothes.    This latest tote is perfect for women to carry for a weekend getaway or even a day at the mall for shopping. It can be paired with formal pants & blazer as well as with a basic crop top and jeans. This spacious and sturdy bag makes for a perfect gift for all your occasions.    The bag has a well stitched inner lining and high quality zippers for easy accessibility and storage.",Cocoblu Retail,B07CJCGM1M
82,Lavie Women's Nova Tote Bag | Ladies Purse Handbag,4.2 out of 5 stars,824,"7,318",https://www.amazon.in/YuvKuz-TM-Infocus-Digitizer-Assembly/dp/B07MXNWTB2,"Water Proof with attached Rain cover.    Reflective Printing and in Built Laptop sleeve    3 compartment, 1 pockets and 2 Bottle pouch.    Comes with the F Gear promise of quality.    Size(Hxlxw)Cm-(50x31x21)",RetailEZ Pvt Ltd,B07CJCGM1M
83,"F Gear Blow Laptop Backpack With Rain Cover 32 Liters (Black,Grey) Sch Bag",4.3 out of 5 stars,1039,"1,245",https://www.amazon.in/F-Gear-Blow-Laptop-Backpack/dp/B078J63VRY,"Slim, compact & sturdy, Minimal and compact design for professionals, Joint material design, durable, water-resistant polyester material. The padded shoulder straps, handle, and back panel provides protection and all-day comfort    Smooth zippers that never jam or break    Style meets Function, Minimal & compact design, stores and protects laptops up to 15.6-inches. Ideal for students and professionals looking for a stylish and compact backpack for daily use    Spacious storage with easy organization, Inside, you'll find a laptop sleeve, a tablet pocket, a roomy front workstation, and two side pockets for quick access to your other essentials    The padded shoulder straps, handle, and back panel provides protection and all-day comfort.",Appario Retail Private Ltd,B07CJCGM1M
84,Lenovo Slim Everyday Backpack,4.4 out of 5 stars,839,"2,631",https://www.amazon.in/Lenovo-15-6-Inches-Everyday-Backpack/dp/B08R7RPVJF,"Faux Material material    Grey colored Satchel Handbag    Strap type , Single    Zip type closing mechanism.    Made in India",Cocoblu Retail,B07CJCGM1M
85,Baggit Women's Sling Bag (Grey),4.3 out of 5 stars,837,778,https://www.amazon.in/Baggit-Womens-Satchel-Handbag-Grey/dp/B098TKJG1L,"Compatible With 15.6"" Laptop , The Lenovo B210 Backpack fits up to 15.6 inch laptop. Dimensions, 34cm x 15cm x 45.5cm; Weight, 453g.    High Quality, Durable and Water Repellent Fabric , This backpack features in durable snow yarn polyester fabric and streamlined design with a padded interior to protect notebooks and important items    Convenient Travel , Adjustable shoulder strap and padded laptop compartment together with a quilted back panel make it comfortable for all-day use. Fits Up To (L x D x H) 255 x 22 x 362 mm    Conveniently Placed Padded Laptop Compartments and Packets , The padded interior helps protect notebooks and important items. Quick access zippered front pocket for added storage. A quilted back panel make it comfortable for all-day use.    High Quality, Casual yet Stylish Design , Very attractive and perfect for school, travel and outdoor activities. The perfect backpack for those needing stylish all-day protection for their laptop    There might be minor color variation between actual product and image shown on screen due to lighting on the photography    In the Box , 15.6-inch Backpack    Country of Origin, China",Appario Retail Private Ltd,B07CJCGM1M
86,Lenovo Casual Laptop Backpack B210 15.6-inch(39.6cm) Water Repellent Black,4.2 out of 5 stars,1011,"53,052",https://www.amazon.in/Lenovo-Laptop-Backpack-15-6-Inch-GX40Q17225/dp/B075Y72PHZ,"Faux Leather material    Green colored Hobo Handbag    Strap type , Single    Zip type closing mechanism.    Made in India",Cocoblu Retail,B07CJCGM1M
87,Baggit Women's PEPSI Sling Bag,4.3 out of 5 stars,812,"1,923",https://www.amazon.in/Baggit-Womens-Hobo-Handbag-Green/dp/B097C2T2DS,"Material, Polyester Fabric PVC Coated (outer), Shock Resistance EPE Layer (middle), Lining Layer (inner); Laptop Sleeve Dimensions, 16 x 1.2 x 11 inch (L × W × H); Charger Pouch Dimension, 8 x 2.1 x 4.3 inch (L × W × H); Sleeve Weight, 175 grams; Pouch Weight, 80 grams    Compatible, 16 inch Macbook and any other Laptops    Warranty, Manufacturer- 1-year domestic warranty    Water Resistance, Yes; Dustproof, Yes; Shock Resistance, Yes    Special feature, Number of the compartment - 1; Slim desgin; Easy to carry itself or Glid into your other backpack; Charger Pouch - carry charger and other small acessories with ease",Appario Retail Private Ltd,B07CJCGM1M
88,Alifiya Polyester MacBook Laptop Sleeve Bag 16 Inch with Charger Pouch (Grey_L26),4.2 out of 5 stars,384,90,https://www.amazon.in/Alifiya-Polyester-MacBook-Charger-Grey_L26/dp/B09GP79C4C,"Dimension , 10'' x 6'' x 8'' , Internal size, 9'' x 5'' x 7'' ; Fits 1 camera +1 spare lens + mobile phone + filter + SD card.    Multiple Accessory Pockets to organize extra batteries, memory cards, cables, lens caps, or other small accessories.    Detachable shoulder strap is adjustable and can also be worn cross-body. Made from durable polyester material, outfitted with reinforced padded carry handle.    The camera compartment is fully padded with closed cell dense foam padding to protect valuable cameras and accessories.    Package Includes, 1*waterproof Camera Case Bag 1*Shoulder Strap 1*Rain Cover 2*Spacer Pad",Appario Retail Private Ltd,B07CJCGM1M
